,question,answer
27094,대구 코스트코에서 비엔나 예식장 반고개 역 갈라 그러면  몇 건을 타야 되는 버스예?,예 선생님 그 코스트코에서 옆 도로를 이분정도만 이동하시면 검단 유성 아파트 서편 정류장이라는 곳이 있습니다. 거기서 순환 이 다시 일번을 타면 되고요 거기서 이제 새길시장 건너라는 정류장에서 하차를 하셔가지고 웨딩 비엔나까지는 도보로 십분 이동하셔야 됩니다.
27095,대구 중구청에서 북대구세무서 가야 되는데 버스노선 좀 알려주시겠어요,선생님께서 계신 그 중구청에서 북대구세무서로 가는 그 노선을 확인을 해보니까 예 좀 환승을 한번 해 주셔야 될 것 같습니다.  한번에 가는 거는 그니까 백일번이라고 해서 태평상가 앞 일 정류장에서 파계사 방면으로 승차하시면 북대구세무서앞까지 이동이 되고요 이거 외에는 선생님 중구청 앞 정류장에서 칠이사를 승차하시고 예 시지브이 대구 한일극장건너 정류장에서 하차하시고 거기서 구삼구번을 승차하셔서 북대구세무서 앞 정류장으로 이동하시면 되세요
27096,대구 중구에 그 보면 자동차 전용 도로 있잖습니까? 그쪽으로는 승용차가 운행을 못하는 건지 이게 뭐 단속이 되는 건지 이거 좀 알 수 있나요,아 네네 고 구간은 이제 일반 승용 차량은 통행을 하실 수가 없습니다.
27097,대구 이십구 더 팔삼오오번 아반떼 엑스디 차량 맞습니까?,예
27100,대구 동구 신암이동 강남약국 근천데요 여기 차가 주차를 해 놓고 전화번호 없이 그냥 가셨어요,그렇겠죠 그러니까 일단은 선생님 저희 시청에서 이제 이 뭐 주정차라던지 이런 부분은 구청교통과에서 담당을 하는데요 끊지 말고 기다려 주시면 구청교통과 바로 연결 도와드릴게요
27101,대구 대구 제가 지금 현풍쪽인데요 그 저 중고차 등록할려고 하면 제일 가까운데가 무 문의해주세요,아 네 그러세요 네 지금 저희가 그 등록할수 있는 차량등록 사업소가 죄송합니다만 만촌동이나 이곡동 그리고 율하동이나 이현동쪽에 있는 걸로 확인되고 있구요
27102,대게 때문에 예약이 빨리 된 거 아니에요?,대게 때문이 아니라 연휴도 있어서 예약이 좀 빨리 된 거 같아요
27109,당일도 세탁해주는가요?,"네, 당일에도 수거하실 수 있습니다"
27110,당일날 취소 건이 있는지 잘 모르는데 계속 전화를 해보는 수밖에 없나요?,오월 오일 오전이나 하루 전에 연락을 한번 주시면 취소 건이 있는지 확인을 해보고 예약을 도와드릴 수밖에 없어요
27116,당뇨체크하는 거 있나요?,"네, 있습니다"
27118,당근 케이크로 부탁드릴게요,그렇게 준비하도록 하겠습니다
27119,당근 케이크는 따로 결제할 수 있나요?,네 그렇게 도와드리겠습니다
27120,당근 케이크같이 주세요,네 알겠습니다
27122,당근 케이크 지금 남아있나요?,네 남아 있습니다
27124,당구장이 스타벅스 건물 4층에 있는 거 맞나요?,네 맞습니다
27125,당구장에서 시켜 먹어도 상관없죠?,"네, 다른 사람들도 많이 시켜 드세요"
27131,당구장 지금 자리 있나요?,네 두 자리 남아있습니다
27133,당구장 자리 있나요?,네 딱 한 테이블 남았어요
27135,당구장 예약이라든지 이런 거도 가능한가요?,예약은 선착순으로 받고 있어요
27136,당구장 예약은 가능한가요?,예약도 가능하신데 당일은 예약이 힘들 수 있으세요
27137,당구장 예약도 혹시 가능한가요?,원하시면 예약도 해드리고 있어요
27149,당구장 안에서 음식 배달시킬 수 있나요?,네 가능합니다
27151,당구장 안에 커피 머신 있나요?,네 얼음도 있어서 차가운 음료 만들어서 드실 수 있어요
27156,당구장 가봤나 봐요?,"네, 당구 좋아해요"
27158,당구대에 열선이 깔려있나요?,네 당구대에 열선 깔려서 따뜻하게 당구 즐기실 수 있습니다
27166,당구대 자리 있나요,네 있습니다
27173,당구 큐대는 무료로 사용할 수 있나요?,네 오른 편에 있는 당구 큐대 쓰시면 되고 사용 다 하시고 다시 꽂아 놓으시면 돼요
27183,당구 강습하는데에 한 오십만원 정도 하면 된다는거죠?,네
27185,담임선생님 별도로 있나요?,네 따로 계세요
27190,담배 냄새 안 나는 방으로 주세요,"네, 금연방으로 드릴게요"
27191,담당자 전화 좀 알려주실래요,예 전화번호 칠사구번에 일공이번에서 일공오오번까지 있습니다.
27195,닭개장하고 닭곰탕하고 이거는 세트로 파나요?,네 세트로 하시면 하나랑 같이요
27205,달방 한 달로 해주세요,"네, 한 달 사용으로 해드릴게요"
27206,달링 포인트 스테이크?,이것은 블랙라벨 메뉴예요
27207,달려 있는 큐빅이 빠지면 AS 가능한가요?,네 가지고 오시면 AS 해 드립니다
27208,달달한 음료 찾으세요?,"네, 그런데 너무 달지 않은 걸로 부탁드려요"
27211,단화는 내피로 안에 털 넣을 수 있고?,"네, 단화는 신발 안 쪽까지 털 넣을 수 있어요"
27213,단화 좀 구경할 수 있을까요?,네 물론입니다
27215,단화 같은 가벼운 신발로 있어요?,네 여기요
27218,단품으로 사면 할인은 안 되나요?,네 할인은 세트로 구매 시에만 적용됩니다
27220,단팥 도너츠 하나하고 고로케 하나 주세요,네 여기 보시면 팥빵도 있습니다
27223,단추 다 열려요?,네 열리게 되게끔 되어 있어요
27224,단추 금방 수선돼요?,"네, 급하신거 금방 해드릴  수 있어요"
27225,단체주문 할 때 한 개당 콜라를 다 주는 거예요?,네
27226,단체석으로 예약할 수 있을까요?,네 8명부터 룸으로 예약이 가능합니다
27228,단체 할인은 혹시 가능한가요?,네 20분 이상 투숙이셔서 10퍼센트 할인 적용해드리겠습니다
27232,단체 예약도 되나요?,"네, 단체 예약받아요"
27234,단체 여섯 명에서 일곱 명 오고 하면 따로 할인 안 되죠?,"네, 할인 안 됩니다"
27241,단백질 바나나 쉐이크는 단백질 파우더 넣어줘요?,네 단백질 바나나 쉐이크에는 단백질 파우더가 들어갑니다
27243,단무지랑 젓가락도 하나 주시겠어요?,네 여기 있습니다
27244,단무지도 한 개만 더 주십시오,네
27245,단무지도 넉넉하게 챙겨주세요,네 넉넉하게 챙겨드리겠습니다
27246,단무지도 꼭 챙겨주시고요,네 여기 포장 나왔습니다
27247,단무지도 같이 주시나요?,네 드립니다
27255,단무지 한 개 더 주시면 안 돼요?,네
27256,단무지 하나만 넣어주세요 나무젓가락도,네
27257,단무지 하나 좀 주시겠어요?,네
27258,단무지 하나 더 주시면 안 될까요?,네
27260,단무지 좀 많이 갖다 주세요,네 알겠습니다
27261,단무지 좀 많이 가져다주실 수 있을까요?,네 그럼요
27262,단무지 좀 더 주시겠어요?,네
27263,단무지 좀 더 주시겠어요?,네 여기 있습니다
27264,단무지 좀 더 주세요,네
27265,단무지 좀 더 주세요,네 드릴게요
27267,단무지 조금만 주세요 ,네 드릴게요
27268,단무지 조금만 주세요,네
27269,단무지 조금만 더 주실래요?,네 여기 있습니다
27270,단무지 조금만 더 주시겠어요?,네 더 드릴게요
27271,단무지 조금만 더 주세요,네
27272,단무지 조금만 더 주세요,네 여기 있습니다
27273,단무지 조금 더 주실래요?,네 더 드릴게요
27274,단무지 조금 더 주시겠어요?,네
27275,단무지 조금 더 주시겠어요?,네 알겠습니다
27277,단무지 많이 주세요,네 잠시만요
27279,단무지 넣어주시는가요?,네 넣어드립니다
27281,단독주택을 보려고 합니다,네 단독주택 매물 있습니다
27283,단독주택으로 매매하고 싶은데 좋은 집이 있을까요?,그렇다면 상왕십리에 있는 집을 추천해드리고 싶네요
27287,단독주택 매물 나온 게 있나요,네 50평대 주택 매물이 있습니다
27289,단독으로 지으실 거예요?,네 단독으로 지으려고 합니다
27290,단독명의로 등록되어 있는 거 맞습니까?,네네네
27291,단독 등록차량인가요,예 예
27293,단계가 있나요?,네 10단계로 나뉩니다
27298,닦으실려구요?,네 마우스 좀 닦으려고요
27303,다이어트 좀 시킬까 싶어서 왔는데 살 좀 빠질까요?,네 줄넘기도 하고 운동량이 많을거에요
27308,다음에는 예약을 하고 오는게 좋겠네요,예약 먼저 진행하고 있어서요
27309,다음에 한 번 들릴게요,네 어머니 조심해서 가세요
27310,다음에 와도 될까요?,네 그러세요
27312,다음에 방문할게요,네 안녕히가세요
27313,다음에 또 와서 옷 살게요,네 또 오세요
27314,다음에 따로 포장만 하려고 할 땐 전화로 문의드려도 될까요?,네 미리 전화 주시고 오시면 시간대 맞춰서 해드려요
27315,다음번에 무료로 하고 이번엔 새로 도장 찍어주세요,네
27319,다음 주말에 이용 가능한가요?,다음 주는 예약이 다 찼습니다
27321,다음 주 토요일에 6인 가능한 방 있나요?,"네, 있어요"
27322,다음 주 토요일로 예약하려고 하는데 가능할까요?,"예, 가능해요"
27323,"다음 주 토요일로 예약하고 싶은데, 방 있나요?",확인해보니 예약 가능하네요
27326,다음 주 주말로 예약해도 되나요?,"네, 지금 예약해 드릴게요"
27329,다음 주 금요일로 예약해주세요,예약되었습니다
27331,다음 주 금요일 디너타임에 가려고 합니다 괜찮을까요,네  가능하세요
27332,다음 주 26일 수요일에 예약하고 싶습니다,그날 예약 가능합니다
27333,다음 저에요?,네 얼마 안 기다려도 돼요
27335,다음 달 예약 가능한 날짜가 있나요?,"네, 중순 이후 예약 가능해요"
27337,다시 한번 전화드릴게요,"네, 전화 주세요"
27339,다시 전화 드리겠습니다,"네, 전화 주세요"
27342,다섯시 삼십분까지 가도 그 은행 그 세금하고 다 할수있나요,아 네네 한 다섯시 삼십분정도로 오시면 네 당일 가능은 합니다 선생님
27343,다섯시 반 그 위치가 어딘가요,혹시 만촌 이마트를 아세요 메트로 메트로 아파트있는 데 말씀하시는 메트로 폴리스 맨 끝 동이 오백팔동이구요 예 오백팔동 앞쪽에 저희 차량등록사업소가 있습니다.
27345,다섯 명 식사 가능한가요?,네 4번 테이블에 앉으세요
27346,다섯 개 정도 가져와도 다 삼천 원이지요?,"네, 가격은 똑같습니다"
27348,다방 이런거랑 같아요?,그런건 다 사진 사와서 하는 거예요
27351,다름이 아니고 차량 등록 확인 좀 할 수 있겠습니까? 제가 누구한테 부탁했는데 등록이 확실히 됐는지 확인 좀 좀 할려고 그러거덩요,그렇게 등록되어 있습니다.
27352,다름이 아니고 차량 고기 이전등록 됐는가 확인 한번 해 볼라구요,예 완전히 다릅니다. 선생님 요고 명의이전 안 된 것 같습니다. 선생님
27359,다른데서는 좀 했었나요?,네 보냈었죠
27366,다른 카드 드릴까요?,네 주세요
27367,다른 집도 전세가 없겠죠?,"네, 그렇죠"
27368,다른 집도 몇 개 더 보고 결정하고 싶어요,같은 동네에 매물이 세 네 개 더 있는데 같이 보도록 하시죠
27369,다른 질문사항은 더 없으신가요?,네 괜찮습니다
27370,다른 지점이랑은 다른 쿠폰인가요?,"네, 지점마다 따로 찍으셔야 해요"
27377,다른 제품으로 교환하면 되나요?,네 고객님 불편을 드려서 죄송합니다
27378,다른 제품보다 저렴한 편이에요?,네 이게 가격대비 효과가 제일 좋습니다
27380,다른 제품도 다 어둡나요?,네
27386,다른 영양제는 없어요?,네 콘드로이틴이 제일 괜찮습니다
27388,다른 약은 없나요?,"네, 전부 소진되었습니다."
27389,다른 약도 추천해 주실수 있나요?,네 건강식품 정도로는 불편하시면 콘드로이틴 제제랑 글루코사민 제제를 드세요
27390,다른 약과같이 먹어도 되나요?,네 혼용 가능하세요
27392,다른 아파트 나온 건 없어요?,"세종 나온 거 있는데, 재개발 되는 거라서 1억 5천만 원 정도예요"
27400,다른 색으로 바꾸실거 아니잖아요?,"네, 그렇게는 안해요"
27402,다른 색상은 없나요?,네 품절됐어요
27403,다른 색상은 없나요?,네이비 있어요
27408,다른 색상도 있나요?,이 색상밖에 없네요
27412,다른 색상도 들어볼 수 있을까요?,네 잠시만 기다려주세요
27413,다른 색상도 같이 보여주실 수 있나요?,네 그럼요
27414,다른 색상 있나요?,"네, 있습니다."
27417,다른 색깔도 있나요?,네 검은색과 베이지색이 있습니다
27418,다른 색 없나요?,네 검정색뿐입니다. 
27424,다른 방으로 업그레이드 해주세요,"네, 여기 바꾸신 방 키 드릴게요"
27430,다른 디자인은 없나요?,현재는 여기에 있는 게 다예요
27431,다른 디자인으로 교환할 수 있나요?,네. 가능합니다.
27432,다른 디자인도 있나요?,네 이건 꾸준히 인기 있는 상품입니다
27435,다른 데 알아보고 계시는 거예요?,네 쪼매라도 싼데 며칠 있을까 싶어서
27436,다른 데 다닌 적 있습니까?,네 영수는 안하고 예체능 배웠어요
27437,다른 당구대로 옮겨도 되나요?,네 물론입니다
27439,다른 날로 예약을 할 수 없는 건가요?,"죄송하지만, 다른 날은 예약이 마감되었어요"
27446,다른 곳도 한번 돌아보고 올게요,네 또 방문해 주세요
27453,다른 건 필요한 거 없으신가요?,네 없어요
27456,다른 거는 추가로 더 사야 한다고요?,네 소스 같은 건 500원씩 구입을 하셔야 돼요
27459,다른 거 한 번 봐도 되죠?,네 보세요
27460,다른 거 더 필요한 건 없으신가요?,네 없어요
27461,다른 가방도 조금 둘러보고 올게요,네 그러세요
27464,다들 초등학생이에요?,네 다 초등학생이에요
27465,다들 점포를 안 내놓는거 보니 장사가 잘 되나봐요?,"네, 잘 안나오려고 해요"
27466,다들 영문학과 나오셨나요?,네 맞습니다
27467,다다음 주 토요일쯤이요?,"예, 다음다음주 토요일에요"
27469,다니던 학원 있으세요?,네 1월부터 지금까지 쉬고있거든요
27470,다가오는 토요일 말이세요?,"예, 다가오는 토요일이요"
27471,다 핸드메이드 제품인가요?,"네, 일반 코트는 없어요"
27477,다 하는 데 2만원이죠?,네 2만원입니다
27479,다 켜져 있는데 안돼요,네 바꿔드릴게요
27484,다 영어 전공하신 선생님들 맞죠?,네 다 영어 전공하신 분들이에요
27485,다 여선생님인가요?,네 여자분이세요
27487,다 손으로 만드신 거예요?,네
27489,다 물세척 되나요?,네
27490,다 못마신 음료 포장 좀 해주시겠어요?,"네, 테이크 아웃 잔에 담아 드릴게요"
27491,다 못마셔서 그런데 포장해주세요,네 포장해드리겠습니다
27494,다 못 먹으면 포장도 해주나요?,네
27495,다 못 먹으면 테이크아웃 되죠?,네
27496,다 못 먹으면 나머지 싸줘요?,예
27497,다 못 먹었는데 포장 좀 해주세요,네
27498,다 못 마시고 가면 포장 가능한가요?,"네, 테이크 아웃 잔에 담아드리는데 10분 정도만 계시면 일회용 컵에 드릴 수 있어요"
27501,다 만 구천 원이에요?,네
27502,다 뚝배기면  앞접시 주세요,네
27503,다 똑같아요?,네 접시 색깔은 다른데 가격은 똑같아요
27504,다 따로 포장해주세요,네 감사합니다
27508,다 국산이죠?,네 거기 다 적혀 있어요
27509,다 국내산이에요? 재료는 다?,네
27510,다 구십프로 해서 팔만 원인 거예요?,"네, 팔십프로 해서 십 칠 만 오천 원이에요"
27511,다 가죽이에요?,네
27512,다 가죽이에요?,네
27518,니트는 살쪄보이나요?,네
27519,니트 티에 수를 놓을 수도 있나요?,네 니트 티에 수를 놓을 수도 있습니다
27520,"니트 티가 올이 나갔는데, 수선될까요?","네, 니트 티는 안으로 엮어내면 수선되겠어요"
27522,니트 치마도 볼 수 있을까요?,네 이쪽에서 보시면 됩니다
27529,니트 3만 8천 원이면 여기서 10% dc 된다 그죠?,네 이거 10% 하면 3만 4천 원이요
27530,늦지 않을까요?,그렇게 늦고 그렇진 않아요
27533,늘어나는 그런 맛도 없네 스판은 없어요?,네 이거는 스판 성분이 없습니다
27538,"뉴욕함박스테이크는 계란, 치즈가 올라가는거에요?",네
27539,뉴에이지가 현대음악입니까?,그렇죠
27540,뉴스에 나오는 거 보시고 그러시는 거죠?,"네, 뉴스에 보니까"
27543,눈꽃 치즈 치킨은 치즈예요?,치즈 가루 뿌려놓은 거예요
27544,눈 나쁠 때 먹어요?,네 오메가 쓰리는 눈이나 기력 회복에 좋습니다
27546,누룽지 숭늉은 직접 하신 거에요?,네
27548,누구인데요? 따님 아드님?,네 우리딸요
27549,누구 선물하시게요?,네
27550,누가 할 거예요?,제가 그냥 간단하게 들려고 하는 거예요
27551,누가 하실 건데요?,제가 할 거예요
27553,누가 입으실건데요?,제가 입을 거예요
27565,누가 먹을 진통제인가요?,초등학생이 먹을 거예요.
27574,농지로 사용할 토지는 매물이 현재 5건 정도 있는데 생각하시는 가격대가 있나요?,평당 30만 원 정도까지 생각하고 있고 500평 정도 거래하고 싶네요
27575,놀이도 하나요?,네 놀이도 해요
27576,논이나 밭을 파실 건가요?,네 밭을 팔겠습니다
27577,녹차로 주세요,네 알겠습니다
27578,녹차로 주세요,네 알겠습니다
27579,녹차로 주세요,네 알겠습니다
27580,녹차랑 티라미수도 맛있고 치즈 좋아하세요?,네 치즈도 괜찮아요 
27585,녹색 계열이 있나요?,"네, 잠시만 기다려주세요."
27587,노트북을 넣을 수 있는 서류 가방 있나요?,네 이쪽에 있습니다
27588,노트북도 넣을 수 있을까요?,네 여기에 안전하게 넣을 수 있는 공간이 있습니다
27589,노트북 하나 정도는 들어갈 수 있으려나?,네 노트북 들어가죠 안에 이렇게 노트북 넣을 수 있게 되어있어요
27590,노트북 수납도 가능한가요?,네 가능합니다
27593,노트북 가방으로 괜찮을까요?,안쪽에 노트북 수납할 수 있는 공간이 따로 있어서 괜찮으실 거예요
27597,노래방은 인원수는 관계없이?,"네, 노래방 룸으로 계산해요"
27600,노래방 비용은 별도로 내야 하나요?,"네, 노래방은 한 시간에 만원이에요"
27601,노래방 말씀하시는 거예요?,"네, 노래방도 있어요"
27604,노란색 한번 볼 수 있을까요?,네 여기 있습니다
27606,노란색 눈에 띄던데 이십 대들이 많이 드는 거 많죠?,네 이십 대 취향 가방 많이 있어요
27610,넷이 먹을 건데 2근이면 되나요?,네 충분하세요
27611,넥타이핀도 있나요?,네 넥타이핀이랑 같이 하시면 할인 가능합니다
27613,네이비색은 없나요?,네 지금 재고가 없습니다
27614,네이비로 매볼 수 있을까요?,네 잠시만요
27615,네이비도 보여주시겠어요?,네 여기 있습니다
27617,네이비 코트는 잘나가요?,네
27618,네이비 컬러 보여주실래요?,네 여기 있습니다
27620,네이비 색상인가요?,네 네이비입니다
27621,네이비 색상 100사이즈 있나요?,네 여기 있습니다
27623,네이비 235 줘보세요,네 여기 있습니다
27624,네이비 110사이즈 입어볼 수 있나요?,네 옆 탈의실에 들어가셔서 입어보시면 됩니다
27626,네이버페이로 결제 가능한가요?,네 결제 가능합니다
27627,네이버로 예약하면 할인되는 그런 건 없죠?,"네이버로 예약해도 요금 비슷해요, 마일리지가 쌓여야 공짜로 이용하든지 해요"
27630,네에 선 골프 이천삼 티디아이 디엠티 맞습니까,네 맞습니다
27632,네에 그럼 제가 서류 안내해 드릴텐데 선생님 본인 여권 만드시는 거죠,예에
27633,네분께서 같은 객실을 이용하시는 거예요?,"네, 객실 하나면 돼요"
27634,네명 자도 상관없어예?,네명 잘 방은 없어요
27635,네네치킨이죠?,네 맞습니다
27637,네네 혹시 미성년자분이 혹시 어 만 십팔세미만이고 만 팔세이상인가요 ,아 네 맞아요
27640,네네 자동차 과표 한개만 물어볼께요,지금 이차량은 이천구년식 차량으로 확인이 되는데요 네 그 기준으로 봤을때 과표가 오백구십육만 삼천원으로 확인되고
27642,네네 아 법인으로 되어 있던 차량이셨구요,예예
27646,네네 그럼 이걸로 할게요,네 26000원이고 뚫고 1달 동안은 귀걸이 빼면 안 되세요
27648,네네 구형으로 말씀해 주셨는데 혹시 대구로 시작하는  초록색 번호판 말씀하시는 거세요,네 맞아요 선생님 차량 번호 변경 가능하세요
27651,네. 일단 면허세는 만오천원 드가죠?,"네, 맞습니다."
27654,네. 무 좀 많이 주세요.,"네, 감사합니다."
27655,네. 그러면 프라이드 2마리 부탁드립니다.,네. 30분 정도 걸릴 거 같아요.
27657,"네, 혹시 차 가져오시나요?","네, 총원 6명 일요일부터 2박 패밀리룸 예약되었어요"
27660,"네, 혹시 2시에 오신다던 #이름# 씨인가요?","네, 제가 #이름#입니다"
27666,"네, 하는데 소장님 나오시는데 전화번호 알려드릴까요?","네, 하나 주세요"
27672,"네, 텀블러에 담아주실 수 있나요? ",네 그럼요.
27673,"네, 타워형 인데 판상형을 더 선호하세요?",네
27676,"네, 카드로 하실 건가요?","네, 영수증은 버려주세요"
27683,"네, 진달래방으로 예약하신 고객님 맞으시죠?","네, 엊그제 예약했어요"
27685,"네, 쥐색보다 저렴한 제품은 없어요?",네
27686,"네, 주차는 여기 타워에 해도 되요?","네, 두 시간 무료 가능하니까 주차증 주시면 찍어 드릴게요"
27687,"네, 주차권 주실 수 있나요?",네 드릴게요.
27690,"네, 조식 서비스는 이용하시겠습니까?","네, 결제 해드릴게요"
27694,"네, 작은 사이즈로 한 잔 드릴까요?","네, 그렇게 해주세요"
27699,"네, 이천 원이죠?","네, 이천 원입니다"
27701,"네, 이거 국물이죠?",네
27707,"네, 예약해드릴까요?","네, 감사합니다"
27711,"네, 예약하셨나요?","네, 아고다로 했어요"
27717,"네, 영수증 필요하세요?","네, 주세요"
27719,"네, 여기는 1층뿐이고, 차는 지하에 주차 하셨어요?","네, 지하에 주차했어요"
27742,"네, 스위트룸으로 2박 예약하신 게 맞으신가요?",룸은 7층 721호예요
27743,"네, 숙박 원하세요?","네, 오늘 하루 숙박이요"
27755,"네, 상가주택이 잘 안 나오나 보네요?","네, 상가주택이 잘 안 나와요"
27757,"네, 삼성페이 결제되죠?","네, 삼성페이 결제 가능해요"
27762,"네, 뷰가 좋은 방이 마침 있는데, 예약 진행 해드릴까요?","네, 결제할게요"
27764,"네, 방금 전화 주신 분 맞으시죠?","네, 오늘 1박 2일 예약했는데요"
27765,"네, 반찬은 셀프인가요?","네, 그렇습니다."
27766,"네, 밑에 카페 아메리카노는 그냥 일반 아메리카노 맞죠?","네, 맞습니다"
27768,"네, 뭐 좀 문의할라고예",네
27797,"네, 디럭스룸 4인 이용하시는 거 맞으세요?","네, 거기에 조식 뷔페까지 같이 결제했어요"
27800,"네, 대신 가격이 좀 내려가는데 괜찮으세요?","네, 상관없습니다."
27801,"네, 당구에 관심이 많으신가 보네요, 아드님이?",예. 맞아요
27803,"네, 다른 사이드 메뉴는 없나요?","네, 저희는 음료만 있어요"
27806,"네, 내일 예약이신가요?","네, 내일 디럭스방으로 두 명이요"
27811,"네, 그런데 중간에 테이크 아웃도 가능한가요?","네, 카운터로 오시면 테이크 아웃 잔에 담아드려요."
27814,"네, 고객님 혹시 봐두신 객실이 따로 있으신가요?","네, 바다가 보이는 디럭스 룸으로 예약하고 싶은데요"
27820,"네, 결제해주세요.",네.
27821,"네, 34평으로 방 3개, 욕실 2개 집 있나요?","네, 괜찮은 매물 있습니다."
27822,"네, 10번 찍으면 무료 쿠폰 드리는 거 있는데 드릴까요?",아니예요
27825,"네, #이름# 씨 맞으시죠?","네, 맞습니다"
27826,"네, #이름# 님 세분 예약하신 거 맞으세요?","네, 맞아요"
27827,"네, #이름# 고객님 투룸 2개 예약 맞으신가요?","네, 투룸 2개 예약했어요"
27828,네 히비스커스라즈 이거는 따뜻하게 나오나봐요,네 몸에 좋은 따뜻한 차예요
27829,네 흰색 번호판에,네예
27831,네 휴지도 같이 주시겠어요?,네 아메리카노 4000원입니다
27832,네 휴지 좀 주시겠어요?,네 휴지 드리겠습니다
27838,네 확인해 보겠습니다. 아반떼 차량이 맞습니까?,예
27841,네 확인해 드릴께요 차번호 불러주시겠습니까,아 예 십이 도 공사구이 십이도 공사구이
27843,네 확인해 드리겠습니다. 차량번호 말씀해 주십시오.,예 구공다 팔육팔육
