,question,answer
8914,자동차 등록 단독 내 명의로 할라 하는데 차주 인감증명서가가가야 됩니까?,예 그러시다면 현재 차주의 차량 매도용 인감증명서와 인감도장이 필요합니다.
8915,자동차 근저당 설정 저기 자동차 근저당 설정하려고 그러는데 글로 가면 되나요,네 저당권 설정 같은 경우에는 저희 차량등록사업소방문 해 주시면 되는데 혹시 어느 사업소로 방문하실 예정이십니까?
8922,자동이체하면 현금영수증 끊어주세요?,네 해드려요
8925,자동이체 통장이 김은경으로 되어있나요?,어 네 맞습니다
8927,자동이체 신청되어 있나요?,어 네 자동이체 되어있습니다
8928,자동이체 신청 혹시 되어있으신가요 선생님,네
8930,자동이체 계좌를 바꿀 수 있나요 전화 상으로,네 선생님 유선 상으로는 저희 콜센터에서는 조금 어렵구요
8931,자동요금 납부됐고 압류 소멸되고 번호판 // 상속포기서 인출 인출을 하니까요 밑에 상속포기자 신분증 사본이라고 첨부 이렇게 되어 있는데 이것도 첨부해야 됩니까?,예 제가 왜 처음에 말씀드린 것처럼 상속포기서에 이제 뭐 상속포기서에 가 서명 또는 도장으로 날인을 하시고 상속포기자 신분증 각각 한 장 준비를 하시라고 쫌 말씀 드렸거든요
8933,자녀분이 전에 운동했었어요?,네 한 3년 배우다 말았어요
8938,자녀분은 태권도 했었어요?,네 2품 하다가 중간에서
8943,자녀는 남자예요 여자예요?,남자예요
8945,자녀가 중3 올라가요?,네
8949,자가용으로 이동하는 게 쉬울까요?,"네, 자가용으로 큰길에서 2분 정도 올라오시면 돼요"
8950,자가용으로 등록되어있는게 맞으습니까,네네네 맞아요
8951,자가용 차량입니까?,예
8953,자가용 승용차 맞습니까?,예 예
8955,잎새 만두하고 멸치국수 주세요,네 알겠습니다
8957,있어요? 보인다 이거는 일본 꺼에요?,일본으로 우리가 수출하는 거예요
8960,"잇몸에 피가 나거나, 붓는 증상이 있으신가요?","네, 부으니까 피나고 그런 거 같아요"
8968,입어봐도 됩니까,네 입어보셔도 됩니다
8969,입어봐도 될까요?,네 탈의실은 뒤에 있습니다
8970,입어봐도 될까요?,네 피팅룸에서 입고 나오시면 됩니다
8975,입어봐도 되죠?,네 피팅룸은 저쪽에 있어요.
8976,입어봐도 되나요?,네 고객님은 슬림 하시니까 이게 잘 어울리실 것 같아요
8977,입어봐도 되나요?,네 탈의실 저쪽입니다
8978,입어봐도 되나요?,네 탈의실은 저쪽에 있습니다
8979,입어봐도 되나요?,"네, 피팅룸은 오른쪽에 있습니다."
8981,입어봐도 돼요?,네 입어 보세요
8982,입어볼게요,네 입어보세요
8983,입어볼게요,네 입어보세요
8986,입어볼 수 있나요?,네 가능하세요
8989,입어 봐도 될까요?,네 한 번 입어보세요
8998,입시영어 하고 계시는지?,네 하고 있습니다
9000,입시 대비군요?,그렇죠
9003,입금해드려도 되구요?,네 가능합니다
9004,입구에다가 누가 좀 승용차를 대가꼬 지금 뭐 차 저희가 뭐 지금 으음 오톤 트럭으로 뭘 좀 끄잡아내야 되는데 작업이 안 되거든예,불법 주정차 때문에 그러시는 거네요 그죠. 예 예 주정차면 구청으로 아마 에 업무 바로 구청으로 연결해 드릴게요 쌤님 네네
9005,입고되면 연락 주실 수 있으신가요?,네 전화번호 남겨주시면 연락드리겠습니다
9007,입고 오신 옷 넣어드릴까요,네 감사합니다
9008,입고 문자 받으신 건가요?,네 받았습니다
9010,임플란트 하고있는데 가그린 괜찮나요?,네 하셔도 돼요
9011,임페타민이라는 제품 있어요?,네 임페타민 있습니다
9012,임페타민이라는 제품 있어요?,네 임페타민 있습니다
9013,임페타민이라는 거 있어요?,네 임페타민 있습니다
9014,임페타민과 비슷한 효능인 거네요?,네 임페타민과 똑같은 효능입니다
9017,임대를 꼭 맞춰진 걸 찾으세요?,"네, 저희는 좀 그래요"
9020,임대로 보실 건가요?,네 그렇습니다
9022,임대 사업용은 아니신 거죠?,네 제가 살 집 지을 땅이 필요합니다
9023,읽을만한 잡지 좀 주세요,네 가져다드릴게요
9025,일회용품 하나 주실래요?,"네, 1000원이에요"
9026,일회용품 필요하신가요?,"네, 주세요"
9027,일회용품 필요하세요?,"네, 주시고 같이 계산해주세요"
9030,일회용 컵에 주세요,네 알겠습니다 준비되면 진동벨로 알려드릴게요
9039,일행이 있는데 2개 가져가도 되나요?,네 가져가셔도 됩니다
9041,일행분은 성인이신가요?,네
9042,일행분들이 덩치가 크나요?,"네, 중고등 학생 하고 성인 두 명씩 총 여덟 명이거든요"
9047,일층인 상가건물 나온 것 있나요?,네 몇 가지 보여드릴게요
9049,"일찍 세탁되는데, 다 말려 나오는 거에요?","네, 스팀 건조로 소독까지 해서 다 말려 드립니다"
9050,일찍 바로 꽂아줘요,오셔서 네 저희 그 수수료 부담하시고 신청하시면 받으 교부받으실수 있습니다
9052,일찍 가도 짐은 보관할 수 있죠?,"네,짐은 맡아 드려요"
9097,일주일에 3일 수업하는 거에요?,네 3일 수업하는 겁니다
9098,일주일에 3번은 가능한가요?,네 돼요
9102,일주일 전이 아니라 2주일 전에 예약해야 하나요?,평소에는 이때쯤 연락해주시면 되는데 이번에만 좀 특별히 빨리 마감된 거예요
9103,일주일 전에 전화를 드려야겠네요?,"네, 일주일 전에 전화 주세요"
9106,일주일 동안?,네 맞아요
9107,일주일 경과되지는 않으셨습니까?,예 일 일주일 되지는 안 되지 싶은데
9108,일점오톤 이상입니까?,예예
9113,일인 식사 가능해요?,네
9114,일인 세트 메뉴 적혀져 있는데,그거 탕수육 혼자 하면 식사 나오는 거예요
9119,일월달 거는 납부됐어예,네 납부됐습니다. 일월 이십육일에 납부되셨고요
9124,일요일은 해요?,네 월요일 뺴고는 다 문열어요 월요일은 정기휴무라서요
9125,일요일은 하세요?,네
9131,일요일은 영업 안 하시죠?,네 일요일은 영업하지 않습니다
9133,일요일은 안 하죠?,"네, 일요일은 휴업입니다"
9134,일요일은 안 하시죠?,네 일요일은 열지 않습니다
9135,일요일은 안 하시죠?,네 일요일은 열지 않습니다
9136,일요일은 안 하시죠?,네 일요일은 열지 않습니다
9137,일요일은 안 하시죠?,"네, 일요일은 쉽니다"
9138,일요일은 안 하시죠?,"네, 일요일은 휴무입니다"
9139,일요일은 안 하세요?,네 일요일은 쉬어요
9140,일요일은 안 열죠?,네 일요일은 안 열어요
9145,일요일은 쉬세요?,네 
9146,일요일은 쉬나요?,네 주말은 영업하지 않습니다
9148,일요일에도 해요?,네 일요일에도 영업합니다
9150,일요일에도 열어요?,"네, 일요일도 영업합니다"
9152,일요일에는 쉬시죠?,네
9153,일요일에는 문 닫죠?,네
9154,일요일에 쉬시나요?,네 일요일은 쉽니다
9155,일요일도 해요?,네
9156,일요일도 해요?,네
9158,일요일도 해예?,네 합니다
9159,일요일도 하죠?,네
9160,일요일도 하세요?,네 열두시부터 열두시까지 합니다
9161,일요일도 하세요?,네 일요일도 운영합니다
9165,일요일도 하나요?,네 해요
9168,일요일도 영업하지요?,예 일요일도 영업합니다
9169,일요일도 영업하세요?,"네, 일요일도 영업합니다"
9170,일요일도 영업하세요?,"네, 일요일도 영업합니다"
9171,일요일도 영업하세요?,"예, 일요일도 영업합니다"
9181,일요일도 열어놔요?,네 주말이 더 낫죠
9184,일요일도 여기 문을 여시나봐요?,"네, 일요일도 영업합니다"
9185,일요일도 여기 문 열어요?,아뇨 정기휴무예요
9188,일요일 영업시간은 똑같죠?,예 일요일도 영업시간은 똑같습니다
9190,일요일 날은 열어놔요?,네 해요
9193,일억 정도로 매입 가능한 땅이 있나요?,네 시 외곽 쪽으로 나가면 매입 가능합니다
9195,일식 식사 되나요? 혼자 식사 되나요?,네네
9196,일시불로 해주세요,"네, 일시불로 결제해 드릴게요"
9197,일시불로 부탁드립니다,"네, 여기 사인해주세요"
9198,일시불로 결제해주세요,네 알겠습니다
9202,일부러 이렇게 삐딱하게 해놨나 봐요?,옆으로 기울일 수 있게 디자인 나온 거예요
9205,일본어 회화를 배울 수 있나요?,"네, 이 학원에서 일본어 회화를 배울 수 있어요"
9208,일반카드만 되는가요?,네
9210,일반재질보다 세모가 더 비싼가요?,네 세모가 더 비쌉니다
9211,일반인이세요,네
9212,일반인 이전가능한지 확인해 드릴까요 선생님 차번호 한번 말씀해 주시겠습니까?,예 삼십일노에 칠공칠사
9214,일반용 팬티는 없어요?,네
9215,일반영수증 하나 주세요,네 신세계 상품권으로 팔천칠백 원 결제해드리겠습니다
9224,일반실 그냥 쉬는 데죠?,공부 하는 데예요
9229,일반 펌으로 웨이브 넣어서 하실 건가요?,"네, 요즘 유행하는 스타일이라고 해서 하려고요"
9232,일반 카푸치노 따듯하게 하나 해주실래요?,"네, 카푸치노 준비해드리겠습니다"
9234,일반 주택이에요?,네 일반 주택이라예
9235,일반 자가용 차량 이전하시는 겁니까,네에
9237,일반 영수증 하나 주세요,네 영수증 드리겠습니다
9240,일반 승용차 중고차 이전등록이세요.,네네
9242,일반 승용차 개인자가용이시죠,예 예
9244,일반 스탠다드룸 말씀하시는 건가요?,룸이 어떤 게 있는지 여쭤보는 거예요
9246,일반 버스 요금 말씀하시는거죠?,네
9252,일반 김밥으로 한 줄만,네
9254,일반 김밥 1줄 참치김밥 1줄 라볶이 1개 주세요,네 알겠습니다
9256,일반 개인이세요,네
9259,일반 1인실이랑 성인 1인실이랑 다르네요?,"네, 가격이 다릅니다"
9261,일박 현금하면 십일만 원이라고 하셨죠?,"네, 현금 십 일만원에 드릴게요"
9262,일박 이일이세요?,"네, 일박 이일이에요"
9263,일동제약에서 나온 제품이네요?,"네, 이번에 나온 신제품입니다"
9264,일대일 식으로?,네 개별 능력이 다 다르기 때문에 각자 다르게 진행됩니다
9273,일단은 색소 염색해야 되겠지요?,예 색소 염색 하셔야 합니다
9275,일단은 다른 지역에서도 할 수는 있는데 이 자가용 차량은 맞으시죠.,네 맞아요
9277,일단 흰색으로 이백삼십으로 드려볼게요 이게 볼하고 등이 넓게 나와가지고 편안하게 신으실 수 있을 거예요,편하기는 하네
9282,일단 좀 묶어두고 제가 퇴직하면 집 짓고 살려고 하는 거라 경기도 쪽이 좋을 것 같아요,집을 지으실 거라면 적어도 200평 정도는 되는 게 좋겠네요
9283,일단 조금 생각해보고 제가 다시 오겠습니다,네 알겠습니다 연락 주세요
9285,일단 자리를 다른 데로 옮겨드릴까요?,네 그렇게 해주세요
9290,일단 세 개만 주세요,네 여기 있습니다
9291,일단 선생님 그 주소를 한번 말씀해 주시면 제가 한번 확인해 보겠습니다.,예 평리육동
9293,일단 생크림 카스텔라 주세요,네 생크림 카스텔라 하나 결제 도와드리겠습니다
9295,일단 비슷한 거라도 보여주세요 ,네 같이 가시죠 
9296,일단 보증금 맞춰서 괜찮은 매물 좀 보여주세요,네 매물 있는 거 보여드릴게요
9297,일단 병원가서 뭐 때문에 빈혈이 생긴건지 검사를 해보는게 제일 낫겠네요?,네 피검사 하셔서 정확한 결과를 보시고 약을 쓰시는게 나아요
9298,일단 물건 보고 더 말씀드려도 될까요?,네 같이 가시죠
9299,일단 레벨테스트 받아야 하겠네요?,네 그렇죠
9300,일단 땅이라도 사놓고 하려는데요?,"네, 괜찮아요"
9301,일단 김밥 한 줄하고 떡볶이하고 납작 만두하고 고기만두 하고 주세요,네 고기만두 군만두 줍니다
9303,일단 규모를 알아야 합니다,네 평수는 10평 정도로 생각하고 있습니다
9305,일단 1층이 아니어서 좀 더 살펴보고 다시 문의드릴게요,네 연락 주세요
9307,일년 계약이죠?,"네, 일년 계약이에요"
9311,일공일일번 차량이구요 지금 한 번 확인을 해 볼 텐데 방문하실 때는 양수 받으시는 개인 분이랑 법인 쪽에서도 사람이 나오시는 거 맞죠 선생님,예
9313,일곱살 자녀분이 우리나라 나이로 일곱 살이라는 건가요,네 만 육세에요
9316,일 인분에 만 삼천 원이에요?,네
9317,일 인분도 돼요?,네
9318,일 인분도 돼요?,네
9319,일 인분 양이 많아 보이는데 원래 그게 일 인분 양이에요?,네 우리 집은 원래 다른 데보다 양이 조금 많아요
9321,일 인당 생수 몇 병이에요?,일 인당 각각 세병까지 들어가 있어요. 인원 추가하실 경우에 네분이시면 네 병이 나가고 있어요
9324,인피니티 풀이 용도 체크인 이후에 사용 가능한가요?,"네, 체크인 이후부터 체크아웃 이전까지 사용 가능해요"
9329,인테리어는 따로 하실거죠?,예
9333,인터넷으로 선생님 자동차 민원 대국민 포털 사이트라는 근데 이 차량 선생님 중고차 말씀하시는 거 맞으시죠.,중고차가 예 그니까 중고차를 이전하니까
9337,인터넷에서 로열 컴블릿 보고 왔는데 있나요?,네 현재 로열 컴블릿은 이쪽에 진열되어 있습니다
9339,인터넷 검색하면 여기 스킨이랑 전화번호 나와예?,네 나와요
9342,인크레더블 버거 주문은 되나요?,네 주문 가능합니다
9344,인크레더블 버거 세트로 하나랑 음료는 주스로 주세요,네 주문받았습니다
9348,인절미 피자는 인절미 가루가 올라가는 거예요?,네
9361,인원이 많아서 그런데 큰 방으로 가능한가요?,"네, 큰 방으로 드릴게요"
9365,인원은 몇 명까지 예약 가능한가요,룸으로 예약 시 10명까지 가능합니다
9366,인원은 기본 4인으로 하고 나중에 변경해도 되나요?,네
9372,인스타보고 왔는데 할인되나요?,네 천천히 둘러보세요
9374,인쇄를 하고 싶은데 가능한가요?,네 가능합니다
9377,"인생 짬뽕 하나, 짜장면 하나 주세요",네
9382,인디언 핑크와 조끼 한 번 입어보세요,이거는 내가 너무 뚱뚱해 보여서 안되겠네요
9387,인기 있는 메뉴가 뭔가요?,네 밀크티 라테가 인기가 좋아요
9393,인근에 가까운 부동산 안내해주실 수 있나요?,네 안내해드리겠습니다.
9396,인공 눈물 살 수 있나요?,네 인공 눈물 있습니다
9398,인감증명서에 양수인도 기재가 돼야 되요,예 본인을 기재하는 게 아니라 그 정보를 알고 주민센터에 가면 주민센터직원이 입력을 해서 출력해 주는 겁니다.
9399,인감증명서도 띠가 가야 된다는 말이죠.,예 인감증명서와 인감도장 그리고 신분증이 필요하다라고 지금 확인이 되시는 사항이구요 예
9400,인감증명서 일반으로 띠면 되는 겁니까?,네 맞습니다.
9401,인감증명서 발급했는데 인감도장은  안가가왔는데 깜짝 잊어뿌고 그러면 어떡합니까,아 그렇습니까? 저희가 인감도장이 필요하세요 샘님 만약에 인감도장 차주께서 못 주시겠다고 하신다면 그 양도증명서 오셔서 양도증명서서류를 적는데 거기 양도인란에 양도인란에 그 양 인감도장을 받아 오시면 되겠어요.
9404,인감도장하고요 다른 거는 도장 찍혀있으면 상관없는 거잖아요,우선은 만약에 인감도장 못 받으신다면은 저희가 이전하실 때 양도증명서라는 서류가 있는데요 예 도장찍으 양도인란에게 도장찍으셨구요 그리고 지금 매도 용 인감 증명서에 매수자분이 공동명의이기 때문에 공동명의자 두 분 다 성함 주민번호주소가 기재가 되어 있어야 됩니다. 그리고 양수인분이 방문하시는 분은 신분증 지참해 주시면 되구요 그리고 방문 못 하시는 분은 지분을 다르게 하신다면은 인감증명서 인감도장 신분증 못가시는 분 필요하고요 예 만약에 지분을 동일하게 한다면 미방문자는 신분증과 도장만 지참해 주시면 됩니다.
9405,인감도장이나 인감증명서도 필요하다고 하던데,아 그렇지는 않습니다. 제가 좀전에 말씀드린 것처럼 현재 차주가 방문을 못하시는 경우에 자동차매도용 인감증명서와 인감도장이 필요한데요 두분 다 지금 오시는 경우에는 인감이나 인감증명서는 필요없습니다.
9406,인감도장은 사용인감계 써도 되잖아요 사용인감계 만들어 가면 되죠.,네
9409,인감도장도 필요해요,네 인감도장 주기 어려우신 경우에는 양도증명서에 인감도장 날인하셔야 됩니다
9410,인감도장도 갖고 가야 합니까?,네 가지고 오셔야 됩니다.
9413,익은게 5피스 5피스 나와요?,예
9423,이틀 숙박 맞으시죠?,"네, 맞아요"
9424,이틀 사용으로 예약하셨네요?,"네, 맞습니다"
9425,이틀 묵는데 매일 방 청소해주시나요?,"네, 매일 방 청소 해드려요"
9429,이층에요?,네
9430,이층도 있나요?,네 이층도 있습니다
9432,이천팔년식 맞으신가요,아 예 예 맞아요
9434,이천십일년식으로 확인되는 차량맞습니까?,네 이천십일년 사월요
9435,이천십일년식 확인되는 차량 맞습니까?,네
9439,이천십삼년식 차량 맞습니까,예예
9440,이천십사년식이시지요 선생님,네 그런 거태요 등록일은
9441,이천십사년식으로 확인되는데 맞습니까?,네 맞아요
9442,이천십년식 맞으신가요,예
9445,이천구년식 맞습니까?,예 이천구년식예
9446,이천구년 차량 맞으세요,예 맞습니다.
9448,"이천 원이고, 드시고 가시는 거에요?","네, 아메리카노 마시고 갈거에요"
9449,이천 원은 안돼요?,"네, 할은 해드릴 수 없습니다"
9450,이천 원 드리면 돼요?,네 감사합니다
9451,이쪽이 남자 가방이죠?,네
9453,이쪽은 초등용이에요?,네 이 쪽은 입학생들용 이건 초등 아니고 같이 써도 되고요
9459,이쪽에 빌라아파트가 #주소#인가요?,"네, #주소# 맞아요"
9460,이쪽에 밤색 부츠는 50% 하시는 거라예?,"네 이쪽으로는 20%, 30%이고요"
9461,이쪽 지역은 어떠세요?,괜찮네요
9465,이쪽 건물이 마음에 드는데 내부사진을 더 볼 수 있나요?,"네, 잠시만 기다리세요."
9468,이지엔 6 있나요?,네 있습니다
9470,이제는 얇은 거만 나오나요?,네
9473,이제 중 1이에요?,"예, 중1"
9474,이제 오면 3월 4일부터 올 거 아녜요?,그렇죠
9475,이제 신학기여서 매물이 별로 없는데 보시겠어요?,"네, 그거라도 보여주세요."
9476,이제 사일공 탈라 탈라고 승강기 있는데 승강기 서지도 안하고 그냥 가버렸어요,어 네 맞습니다. 선생님 불편드려서 정말 죄송하구요 선생님 그럼 관련으로 제가 그 해당 회사 쪽으로 이런 부분 대해서 주의될 수 있도록 바로 한 번 전달드리도록 하겠습니다.
9477,이제 봄이면은 앞 트인게 안 낫겠습니까?,저는 별로예요
9478,이제 방문은 아드님은 못하시고 아버님만 오신다는 말씀이시구요,예
9479,이제 되는 건가요?,네 즐거운 게임 하세요
9480,이제 그럼 계산돼요?,네
9481,이제 고등학교 졸업한 아가씨들한테 선물 할 만한 목걸이 있나요?,이런 것도 예뻐요.
9482,이제 겨울 옷을 다 나갔나요?,네
9489,이전비요 선생님 이전비 말씀하시는 거 맞으시죠.,네 이전할 때
9494,이전 받으시는 아버님께서는 직접 방문해 주실 수 있으세요,네 네 아버님 같이 갈 수 있어요.
9495,이전 받으시는 분도 개인단독으로 받으시는 거세요,네네
9505,이월 상품들은 제가 입어볼 수 있나요?,네 가능합니다
9508,이월 상품 세일하나요?,네 진행 중입니다
9517,이용요금은 인원수에 따라 비용이 달라지나요?,"네, 원래 4인 기준에 30만원이에요"
9532,이왕이면 조용한 방으로 안내해 주세요,"네, 안쪽의 조용한 객실로 드릴게요"
9534,이억 원에 취등록세 포함하고 복비까지 포함한 겁니까?,"네, 부대비용 다 포함해서요"
9536,이억 삼천오백만 원 정도 분양 되겠네?,"네, 개발 끝나면 그 정도 오를거예요"
9538,이십평대 아파트요?,"네, 이십평대 아파트요"
9539,이십평대 아파트는 매물 나온 게 있나요?,"아니요, 그 집이 정리됐는지 모르겠네요"
9542,이십팔일 아홉시부터 여섯시까지 아무 데나 가도 상관없나요,네 네 지금 혹시 방문을 여권 같은 경우에는 시청 뿐만 아니라 중구청을 제외한 다른 가까운 구청도 여권 업무가 가능합니다
9543,"이십일, 토요일 말씀하시는 거예요?","네, 이십일 토요일 맞아요"
9545,"이십육일, 이십칠일, 이십팔일이 맞으세요?","네, 이십육일부터 삼일이요"
9548,이십대 남자애랑 먹을 건데 우리고구마가 나은가요 이게 나은가요?,이게 더 나을 거 같네요
9551,이십 인분이면 일 인분씩 한 도시락에 담아 주시는거죠?,네
9556,이사하시면은 지금 명의변경은 먼저 수정을 하시는 겁니까? 선생님,네 해 주세요
9558,이사를 하면 이게 이게 그것도 같이 저기 바뀝니까? 주소지가 바뀌면,네 개인차량 같은 경우에는 전입신고하시면은 주소지가 본거지 주소지가 자동적으로 변경이 되구요
9559,이사를 일주일 안에 가고 싶은데 가능할까요?,네 이사까지 일주일이면 충분합니다
9561,이사를 새로 들어오신 겁니까?,네 저희가 건물을 사서 들어왔기 땜에 이분은 인제 그때 토지주
9584,이사 오신 지는 좀 되신 건가요 선생님,예 쪼금 됐습니다.
9596,이불이나 베개는 추가로 더 주실 수 있는 거죠?,"네, 이불, 베개는 깨끗한 거로 준비해드려요"
9600,이불은 넉넉히 있나요?,"네, 이불은 넉넉하세요"
9605,이불도 세탁되나요?,네 극세사 이불 세탁까지 다 가능합니다
9611,이불 세탁해줘요?,"네, 해드립니다"
9613,이불 사이즈에 따라 가격 틀리죠?,"네, 이불은 드라이 맡기는 게 좋습니다"
9615,이불 맡기면 다 말려서 돌려주시죠?,네 건조기에 넣고 돌려서 먼지가 깨끗하게 떨어집니다
9617,이불 건조는 다 해주시는 거죠?,"네, 건조까지 해드리고 있습니다"
9618,이벤트는 3월에 또 하나요?,"네, 릴레이 이벤트로 진행 예정이며, 첫 주는 파카, 둘째 주는 스웨터로 나눠서 진행할 예정이고, 28일까지는 모든 품목 모두 이십 프로니까 목요일 전에 전부 맡기는 게 좋으실 거에요"
9619,이벤트가로는 평일에만 가능한가요?,네 평일만 해당되세요
9620,이벤트가 있다고 들었는데 맞나요?,네 현재 원 플러스 원 이벤트 진행 중입니다
9624,이벤트 있나요?,"네, 이벤트 신청하시면 비용이 발생해요"
9625,이베리코포크가 돼지고기 인가요?,네 스페인 돼지고기요
9629,이번에 신상품 라인이 디자인이 다 이쁘게 나왔어요,네 다 이쁘네요
9632,이번에 새로 나온 거예요?,네
9633,이번에 새로 나온 가방 여기 입고됐나요?,아직 입고는 안됐고 지금 예약받고 있습니다
9634,이번에 나온 신상품인가요?,네 이번 SS 시즌에 맞춰 나온 상품입니다
9636,이번에 1학년이에요?,아뇨 유치부예요
9637,이번 토요일 말씀하시는 거죠?,"네, 십육 일쯤"
9638,이번 주요?,"네, 이번 주 금, 토, 일이요"
9639,이번 주에 볼 수 있을까요?,네 내일 방문 가능합니다
9641,이번 주말에 패밀리 A 숙소 예약 가능한가요?,아니요 고객님 이번 주말은 예약이 꽉 찼습니다
9642,이번 주말에 숙박할 수 있는 방이 있나요?,"네, 있어요"
9643,이번 주말에 빈 방 있나요?,"네, 이번 주말에 빈 방 있어요"
9644,이번 주말에 4인실 예약이 가능한가요?,"네, 이번 주말 4인실 예약 가능하세요"
9645,이번 주말에 2인 2박 예약하고 싶은데 혹시 가능한가요?,"네, 예약 가능해요"
9646,이번 주말 예약 가능한가요?,"네, 가능해요"
9649,이번 주 토요일에 1박 하고 싶은데 예약될까요?,"네, 가능해요"
9650,이번 주 토요일 밤 예약 가능할까요?,이번 주 토요일로 예약 가능해요
9651,이번 주 토요일 맞으세요?,"네, 4월 6일 토요일에요"
9652,이번 주 토요일 말씀하시는 거죠?,"네, 삼월 구일 토요일이에요"
9654,이번 주 토요일 10명 룸으로 예약하고 싶은데 가능한가요?,네 가능하십니다
9657,이번 주 주말에 가능한가요?,"네, 금요일이랑 일요일 가능해요"
9658,이번 주 주말 1박 2일로 되나요?,"네, 가능하세요"
9661,이번 주 일요일 오후에 예약 가능한가요?,네 가능합니다
9662,이번 주 일요일 12시에 4명 예약 가능한가요?,네 가능합니다
